{
  "version": 1,
  "require_rigid": true,
  "required_joints": [
    {
      "between": [
        1,
        10
      ]
    },
    {
      "between": [
        1,
        0
      ]
    },
    {
      "between": [
        2,
        9
      ]
    },
    {
      "between": [
        2,
        0
      ]
    },
    {
      "between": [
        3,
        11
      ]
    },
    {
      "between": [
        3,
        0
      ]
    },
    {
      "between": [
        4,
        12
      ]
    },
    {
      "between": [
        4,
        0
      ]
    },
    {
      "between": [
        5,
        10
      ]
    },
    {
      "between": [
        5,
        0
      ]
    },
    {
      "between": [
        6,
        9
      ]
    },
    {
      "between": [
        6,
        0
      ]
    },
    {
      "between": [
        7,
        11
      ]
    },
    {
      "between": [
        7,
        0
      ]
    },
    {
      "between": [
        8,
        12
      ]
    },
    {
      "between": [
        8,
        0
      ]
    }
  ],
  "assembly": [
    {
      "connector": 1,
      "before": [
        10
      ]
    },
    {
      "connector": 2,
      "before": [
        9
      ]
    },
    {
      "connector": 3,
      "before": [
        11
      ]
    },
    {
      "connector": 4,
      "before": [
        12
      ]
    },
    {
      "connector": 5,
      "before": [
        10
      ]
    },
    {
      "connector": 6,
      "before": [
        9
      ]
    },
    {
      "connector": 7,
      "before": [
        11
      ]
    },
    {
      "connector": 8,
      "before": [
        12
      ]
    }
  ],
  "model_sha256": "7d6b838c5a8a34ce4293583d6bcf5ef906353b2bcbe56a7fed4ed7e91f805973"
}
