{
  "scope": "joints",
  "required_joints": [
    {
      "between": [
        0,
        2
      ],
      "minimum": 4
    },
    {
      "between": [
        2,
        4
      ],
      "minimum": 4
    },
    {
      "between": [
        4,
        6
      ],
      "minimum": 4
    },
    {
      "between": [
        6,
        8
      ],
      "minimum": 4
    },
    {
      "between": [
        8,
        10
      ],
      "minimum": 4
    },
    {
      "between": [
        10,
        12
      ],
      "minimum": 4
    },
    {
      "between": [
        12,
        14
      ],
      "minimum": 4
    },
    {
      "between": [
        14,
        16
      ],
      "minimum": 4
    },
    {
      "between": [
        16,
        18
      ],
      "minimum": 4
    },
    {
      "between": [
        18,
        20
      ],
      "minimum": 2
    },
    {
      "between": [
        18,
        21
      ],
      "minimum": 2
    },
    {
      "between": [
        21,
        23
      ],
      "minimum": 2
    },
    {
      "between": [
        1,
        3
      ],
      "minimum": 4
    },
    {
      "between": [
        3,
        5
      ],
      "minimum": 4
    },
    {
      "between": [
        5,
        7
      ],
      "minimum": 4
    },
    {
      "between": [
        7,
        9
      ],
      "minimum": 4
    },
    {
      "between": [
        9,
        11
      ],
      "minimum": 4
    },
    {
      "between": [
        11,
        13
      ],
      "minimum": 4
    },
    {
      "between": [
        13,
        15
      ],
      "minimum": 4
    },
    {
      "between": [
        15,
        17
      ],
      "minimum": 4
    },
    {
      "between": [
        17,
        19
      ],
      "minimum": 4
    },
    {
      "between": [
        19,
        20
      ],
      "minimum": 2
    },
    {
      "between": [
        19,
        22
      ],
      "minimum": 2
    },
    {
      "between": [
        22,
        23
      ],
      "minimum": 2
    },
    {
      "between": [
        20,
        23
      ],
      "minimum": 16
    }
  ],
  "version": 1,
  "model_sha256": "2658395f2d9e4d7d5cccf9d03dd2857103fe3b995da36bc67d4634b51e0cb218"
}
